{
  "id": "0247c08e-3c1f-4fcd-94f1-cb014bcca4e7",
  "code": "0034",
  "name": "Bawcomville",
  "picture": "https://placeimg.com/640/480/tech?t=2340826043",
  "location": {
    "address": "515 Kay Court, Bellamy, Federated States Of Micronesia, 8830",
    "geo": {
      "lat": 13.634357,
      "lon": -108.36603
    }
  }
}
